{
  "generatedAt": "2026-05-24T12:59:59.092Z",
  "editionDate": "2026-05-24",
  "sources": [
    {
      "name": "The Guardian World",
      "url": "https://www.theguardian.com/world/rss",
      "category": "world",
      "categoryLabel": {
        "en": "World",
        "zh": "全球"
      }
    },
    {
      "name": "BBC News World",
      "url": "https://feeds.bbci.co.uk/news/world/rss.xml",
      "category": "world",
      "categoryLabel": {
        "en": "World",
        "zh": "全球"
      }
    },
    {
      "name": "SBS News World",
      "url": "https://www.sbs.com.au/news/topic/world/feed",
      "category": "world",
      "categoryLabel": {
        "en": "World",
        "zh": "全球"
      }
    },
    {
      "name": "DW World",
      "url": "https://rss.dw.com/rdf/rss-en-world",
      "category": "world",
      "categoryLabel": {
        "en": "World",
        "zh": "全球"
      }
    },
    {
      "name": "The Guardian China",
      "url": "https://www.theguardian.com/world/china/rss",
      "category": "china",
      "categoryLabel": {
        "en": "China",
        "zh": "中国"
      }
    },
    {
      "name": "BBC News China Focus",
      "url": "https://feeds.bbci.co.uk/news/world/rss.xml",
      "category": "china",
      "categoryLabel": {
        "en": "China",
        "zh": "中国"
      }
    },
    {
      "name": "SBS News China Focus",
      "url": "https://www.sbs.com.au/news/topic/world/feed",
      "category": "china",
      "categoryLabel": {
        "en": "China",
        "zh": "中国"
      }
    },
    {
      "name": "DW Asia China Focus",
      "url": "https://rss.dw.com/rdf/rss-en-asia",
      "category": "china",
      "categoryLabel": {
        "en": "China",
        "zh": "中国"
      }
    },
    {
      "name": "The Guardian Australia",
      "url": "https://www.theguardian.com/australia-news/rss",
      "category": "australia",
      "categoryLabel": {
        "en": "Australia",
        "zh": "澳洲"
      }
    },
    {
      "name": "SBS News Australia",
      "url": "https://www.sbs.com.au/news/topic/australia/feed",
      "category": "australia",
      "categoryLabel": {
        "en": "Australia",
        "zh": "澳洲"
      }
    }
  ],
  "sections": {
    "world": {
      "id": "world",
      "title": {
        "en": "World Desk",
        "zh": "全球焦点"
      },
      "strap": {
        "en": "A fast view of global affairs, conflict, diplomacy, and human need.",
        "zh": "快速掌握国际局势、冲突、外交与人类处境。"
      },
      "sourceNotes": [
        "BBC News World",
        "The Guardian World",
        "DW World",
        "SBS News World"
      ],
      "items": [
        {
          "id": "www-bbc-com-news-articles-cm2pkd58xldo-at-medium-rss-at-campaign-rss",
          "section": "world",
          "source": "BBC News World",
          "sourceUrl": "https://feeds.bbci.co.uk/news/world/rss.xml",
          "link": "https://www.bbc.com/news/articles/cm2pkd58xldo?at_medium=RSS&at_campaign=rss",
          "image": "https://ichef.bbci.co.uk/news/1024/branded_news/fc37/live/290cfef0-574a-11f1-934b-4138723911fd.jpg",
          "publishedAt": "2026-05-24T12:26:09.000Z",
          "title": {
            "en": "Blast targeting train kills at least 20 in Pakistan",
            "zh": "巴基斯坦列车遭爆炸袭击，至少20人死亡"
          },
          "summary": {
            "en": "At least 20 people were killed in Pakistan when a train transporting military personnel home for Eid was attacked by armed separatists.",
            "zh": "官员称，一列载有军事人员返乡过开斋节的火车在巴基斯坦遭到武装分裂分子的袭击，造成至少20人死亡。"
          },
          "body": {
            "en": "At least 20 people have been killed and 70 others injured in an explosion targeting a train transporting military personnel in Pakistan.\n\nThe blast occurred while the train was travelling through Chaman Phatak station in Quetta, the capital of the western Balochistan region, on Sunday morning.\n\nRailway officials told BBC Urdu that three coaches and the engine were derailed while two were overturned. The shuttle service had primarily been transporting service personnel and their families who had been returning home for Eid.\n\nThe Balochistan Liberation Army (BLA) separatist group claimed responsibility for the attack, saying it was a suicide bombing. Pakistani officials have not yet confirmed this.\n\nImages from the scene show burnt-out and mangled carriages and nearby cars, as well as bomb damage to a nearby building.\n\n\"The train was moving and there were passengers on board when the explosion occurred,\" Naseer Ahmed, a local resident, told the BBC.\n\nHe said that, as it had been a Sunday morning, his family had been asleep when the blast happened, shattering all his windows.\n\nEyewitnesses said a vehicle laden with explosives drove into the train, causing the explosion.\n\nA police officer and civil administration official in Balochistan confirmed to BBC Urdu that 20 people had been killed, with fears the death toll could rise. Officials said three soldiers were among the dead.\n\nPakistan's Prime Minister Shehbaz Sharif strongly condemned the attack, saying \"such cowardly acts of terrorism cannot weaken the resolve of the people of Pakistan\".\n\n\"The entire nation stands in solidarity with the people of Balochistan in this hour of grief,\" he added.\n\nThose aboard the train had been on their way to Quetta's main railway station from a nearby military encampment, officials said. From there, they were due to travel to Peshawar and then on to their home towns for the holiday.\n\nIt is not the first time the BLA has targeted trains in Balochistan. In the past two years, the Jaffar Express has come under attack from the armed group many times.\n\nMilitants hijacked a train and took a number of passengers hostage while en route to Peshawar in March 2025.\n\nThe BLA accuses Pakistan's federal government of exploiting the rich mineral resources of its largest province without the local population benefiting.\n\nBalochistan covers nearly 44% of the country's land, sharing volatile borders with Iran and Afghanistan, and covering part of the Arabian Sea coastline. It is home to about 5% of the country's more than 240 million people.\n\nViolence between BLA fighters and Pakistani security forces erupted in Quetta and across the region in early February, leading to the deaths of 31 civilians.",
            "zh": "巴基斯坦一列运送军事人员的火车发生爆炸，造成至少 20 人死亡、70 人受伤。 周日早上，火车在经过俾路支省西部首府奎达的查曼法塔克车站时发生爆炸。 铁路官员告诉 BBC 乌尔都语，三辆车厢和发动机脱轨，两辆车厢翻车。班车服务主要是运送开斋节回家的服务人员及其家人。 俾路支省解放军（BLA）分离主义组织声称对此次袭击负责，称这是一起自杀式爆炸事件。巴基斯坦官员尚未证实这一点。 现场图像显示，车厢和附近的汽车被烧毁和损毁，附近的建筑物也被炸弹损坏。 当地居民纳西尔·艾哈迈德 (Naseer Ahmed) 告诉 BBC：“爆炸发生时，火车正在行驶，车上有乘客。” 他说，由于那是周日早上，爆炸发生时他的家人正在睡觉，他所有的窗户都被震碎了。 俾路支省的一名警官和民政官员向 BBC 乌尔都语证实，已有 20 人死亡，但人们担心死亡人数可能会上升。 巴基斯坦总理谢赫巴兹·谢里夫强烈谴责此次袭击，称“这种懦弱的恐怖主义行为不能削弱巴基斯坦人民的决心”。 他补充说：“在这个悲伤的时刻，全国人民与俾路支省人民站在一起。” 官员称，火车上的人是从附近的军事营地前往奎达主要火车站的。他们将从那里前往白沙瓦，然后返回家乡度假。 这并不是 BLA 第一次针对俾路支省的火车进行攻击。近两年来，贾法尔快车多次遭到武装组织袭击。 2025 年 3 月，武装分子在前往白沙瓦的途中劫持了一列火车，并将多名乘客扣为人质。 BLA 指责巴基斯坦联邦政府开采其最大省份丰富的矿产资源，而当地居民却没有受益。 俾路支省占该国近 44% 的土地，与伊朗和阿富汗接壤，边界动荡，并覆盖阿拉伯海海岸线的部分地区。该国人口超过 2.4 亿，其中约 5% 居住在该国。 2 月初，BLA 战士与巴基斯坦安全部队在奎达和整个地区爆发暴力冲突，导致 31 名平民死亡。"
          },
          "reflection": {
            "en": "The tragic attack on a train carrying military personnel highlights the devastating cycle of violence that often traps communities. Jesus' words remind us that resorting to the sword often leads to more suffering, perpetuating a destructive pattern. This event underscores the profound human cost when conflict escalates.",
            "zh": "针对载有军事人员的列车发生的悲剧性袭击，凸显了暴力循环往往使社群陷入困境。雅伟的话语提醒我们，诉诸刀剑往往会带来更多的苦难，使破坏性的模式持续下去。这一事件强调了冲突升级时所付出的沉重生命代价。"
          },
          "verse": {
            "reference": "Matthew 26:52",
            "textEn": "All who draw the sword will die by the sword.",
            "textZh": "凡动刀的，必死在刀下。",
            "themeEn": "Cycle of violence",
            "themeZh": "动刀者必亡于刀"
          },
          "aiVerseId": "matt_26_52",
          "translationState": "localized"
        },
        {
          "id": "www-theguardian-com-world-live-2026-may-24-iran-deal-strait-of-hormuz-tr",
          "section": "world",
          "source": "The Guardian World",
          "sourceUrl": "https://www.theguardian.com/world/rss",
          "link": "https://www.theguardian.com/world/live/2026/may/24/iran-deal-strait-of-hormuz-trump-middle-east-crisis-live",
          "image": "https://i.guim.co.uk/img/media/723805846e5f9ee8d127c14802e819a080485c73/254_0_1680_1344/master/1680.jpg?width=1200&height=630&quality=85&auto=format&fit=crop&precrop=40:21,offset-x50,offset-y0&overlay-align=bottom%2Cleft&overlay-width=100p&overlay-base64=L2ltZy9zdGF0aWMvb3ZlcmxheXMvdGctbGl2ZS5wbmc&enable=upscale&s=d0db2f3e37969d8469a72aec54a73ee1",
          "publishedAt": "2026-05-24T12:16:44.000Z",
          "title": {
            "en": "Middle East crisis live: Rubio sees initial progress on reopening Hormuz after Trump claims Iran deal ‘largely negotiated’",
            "zh": "中东危机：霍尔木兹海峡命运悬而未决，特朗普称伊朗协议“已基本谈妥”"
          },
          "summary": {
            "en": "The US president has stated that a deal with Iran, which includes opening the Strait of Hormuz, is largely negotiated. However, Iran's Fars news agency reports that the vital waterway would remain under Iranian control, indicating ongoing disagreement.",
            "zh": "美国总统表示，与伊朗达成的一项协议（其中包括开放霍尔木兹海峡）已基本谈妥。然而，伊朗法尔斯通讯社报道称，这条重要的水道将继续由伊朗控制，表明双方仍存在分歧。"
          },
          "body": {